[
  {
    "appId": 100,
    "module": "heat_pump",
    "author": "kosmar",
    "version": "0.1.0"
  },
  {
    "appId": 101,
    "module": "grooves",
    "author": "kosmar",
    "version": "0.1.0"
  },
  {
    "appId": 104,
    "module": "echolot",
    "author": "kosmar",
    "version": "0.1.1"
  },
  {
    "appId": 110,
    "module": "control_issues",
    "author": "kosmar",
    "version": "0.1.1"
  },
  {
    "appId": 111,
    "module": "venn",
    "author": "kosmar",
    "version": "0.1.0"
  },
  {
    "appId": 114,
    "module": "manifold",
    "author": "kosmar",
    "version": "0.1.0"
  },
  {
    "appId": 115,
    "module": "ripppple",
    "author": "kosmar",
    "version": "0.1.1"
  },
  {
    "appId": 116,
    "module": "dit_dah",
    "author": "kosmar",
    "version": "0.1.0"
  },
  {
    "appId": 117,
    "module": "maniac_bounce",
    "author": "kosmar",
    "version": "0.1.1"
  },
  {
    "appId": 102,
    "module": "fibonacci_gate",
    "author": "kosmar",
    "version": "0.1.1"
  },
  {
    "appId": 103,
    "module": "super_lfo",
    "author": "kosmar",
    "version": "0.1.1"
  },
  {
    "appId": 105,
    "module": "arp_de_levy",
    "author": "kosmar",
    "version": "0.1.1"
  },
  {
    "appId": 106,
    "module": "vamp",
    "author": "kosmar",
    "version": "0.1.1"
  },
  {
    "appId": 107,
    "module": "hold_sam",
    "author": "kosmar",
    "version": "0.1.0"
  },
  {
    "appId": 108,
    "module": "harmonica",
    "author": "kosmar",
    "version": "0.1.1"
  },
  {
    "appId": 109,
    "module": "loop_de_cay",
    "author": "kosmar",
    "version": "0.1.1"
  },
  {
    "appId": 112,
    "module": "bassment",
    "author": "kosmar",
    "version": "0.1.1"
  },
  {
    "appId": 113,
    "module": "contura",
    "author": "kosmar",
    "version": "0.1.1"
  },
  {
    "appId": 118,
    "module": "giant_steps",
    "author": "kosmar",
    "version": "0.1.1"
  },
  {
    "appId": 119,
    "module": "axis_matrix",
    "author": "kosmar",
    "version": "0.2.0"
  },
  {
    "appId": 120,
    "module": "sift",
    "author": "thorinside",
    "version": "0.1.0"
  },
  {
    "appId": 123,
    "module": "dozen_ctrl",
    "author": "kosmar",
    "version": "0.1.0"
  },
  {
    "appId": 124,
    "module": "semmy",
    "author": "kosmar",
    "version": "0.1.0"
  },
  {
    "appId": 121,
    "module": "umbra",
    "author": "kosmar",
    "version": "0.1.0"
  },
  {
    "appId": 122,
    "module": "volata",
    "author": "kosmar",
    "version": "0.1.0"
  },
  {
    "appId": 125,
    "module": "techno_hihat",
    "author": "andreyapanov",
    "version": "0.1.0"
  },
  {
    "appId": 126,
    "module": "techno_kick",
    "author": "andreyapanov",
    "version": "0.1.0"
  },
  {
    "appId": 129,
    "module": "adsr_3ch",
    "author": "ATOVproject",
    "version": "0.1.0"
  },
  {
    "appId": 131,
    "module": "macro_control",
    "author": "ATOVproject",
    "version": "0.1.0"
  },
  {
    "appId": 130,
    "module": "macro_control_ranges",
    "author": "ATOVproject",
    "version": "0.1.0"
  },
  {
    "appId": 128,
    "module": "adsr_4ch",
    "author": "ATOVproject",
    "version": "0.1.0"
  }
]
